{
  "schema_version": "1.0",
  "module": "classa_opamp",
  "units": "um",
  "source": {
    "netlist": "examples/classa_opamp/opamp.sized.sp",
    "schematic": "examples/classa_opamp/schematic.png",
    "license": "MIT",
    "notes": "16-MOS class-A reference. Upstream label class-AB is corrected: M13 is a PMOS current-source load; only M14 is signal-driven."
  },
  "devices": [
    {"name": "M1",  "role": "input_pair",     "group": "IN_DP",    "W_um": 10, "L_um": 4, "m": 8,   "fingers": 8,   "sd_mode": "shared", "ring": true, "well": "PW", "matched": true},
    {"name": "M2",  "role": "input_pair",     "group": "IN_DP",    "W_um": 10, "L_um": 4, "m": 8,   "fingers": 8,   "sd_mode": "shared", "ring": true, "well": "PW", "matched": true},
    {"name": "M3",  "role": "current_mirror", "group": "LOAD_P",   "W_um": 8,  "L_um": 1, "m": 8,   "fingers": 8,   "sd_mode": "shared", "ring": true, "well": "NW", "matched": true},
    {"name": "M4",  "role": "current_mirror", "group": "LOAD_P",   "W_um": 8,  "L_um": 1, "m": 8,   "fingers": 8,   "sd_mode": "shared", "ring": true, "well": "NW", "matched": true},
    {"name": "M5",  "role": "bias",           "group": "BIAS_N",   "W_um": 2,  "L_um": 2, "m": 81,  "fingers": 81,  "sd_mode": "shared", "ring": true, "well": "PW", "matched": true},
    {"name": "M6",  "role": "cascode",        "group": "FOLD_P",   "W_um": 12, "L_um": 2, "m": 20,  "fingers": 20,  "sd_mode": "shared", "ring": true, "well": "NW", "matched": true},
    {"name": "M7",  "role": "cascode",        "group": "FOLD_P",   "W_um": 12, "L_um": 2, "m": 20,  "fingers": 20,  "sd_mode": "shared", "ring": true, "well": "NW", "matched": true},
    {"name": "M8",  "role": "current_mirror", "group": "MIRROR_N", "W_um": 9,  "L_um": 2, "m": 12,  "fingers": 12,  "sd_mode": "shared", "ring": true, "well": "PW", "matched": true},
    {"name": "M9",  "role": "current_mirror", "group": "MIRROR_N", "W_um": 9,  "L_um": 2, "m": 12,  "fingers": 12,  "sd_mode": "shared", "ring": true, "well": "PW", "matched": true},
    {"name": "M10", "role": "bias",           "group": "BIAS_N",   "W_um": 2,  "L_um": 2, "m": 97,  "fingers": 97,  "sd_mode": "shared", "ring": true, "well": "PW", "matched": true},
    {"name": "M11", "role": "current_mirror", "group": "MIRROR_P", "W_um": 8,  "L_um": 1, "m": 30,  "fingers": 30,  "sd_mode": "shared", "ring": true, "well": "NW", "matched": true},
    {"name": "M12", "role": "current_mirror", "group": "MIRROR_P", "W_um": 8,  "L_um": 1, "m": 30,  "fingers": 30,  "sd_mode": "shared", "ring": true, "well": "NW", "matched": true},
    {"name": "M13", "role": "current_mirror", "group": "MIRROR_P", "W_um": 8,  "L_um": 1, "m": 80,  "fingers": 80,  "sd_mode": "shared", "ring": true, "well": "NW", "matched": true},
    {"name": "M14", "role": "output_stage",   "group": "OUT",      "W_um": 18, "L_um": 1, "m": 100, "fingers": 100, "sd_mode": "shared", "ring": true, "well": "DNW", "matched": false},
    {"name": "M15", "role": "current_mirror", "group": "LOAD_P",   "W_um": 8,  "L_um": 1, "m": 16,  "fingers": 16,  "sd_mode": "shared", "ring": true, "well": "NW", "matched": true},
    {"name": "M16", "role": "bias",           "group": "BIAS_N",   "W_um": 2,  "L_um": 2, "m": 81,  "fingers": 81,  "sd_mode": "shared", "ring": true, "well": "PW", "matched": true}
  ],
  "groups": [
    {"name": "IN_DP",    "members": ["M1", "M2"],              "matched": true,  "ring": true, "well": "PW", "preferred_rows": [2, 4, 6]},
    {"name": "LOAD_P",   "members": ["M15", "M3", "M4"],       "matched": true,  "ring": true, "well": "NW", "preferred_rows": [2, 4, 6]},
    {"name": "MIRROR_N", "members": ["M8", "M9"],              "matched": true,  "ring": true, "well": "PW", "preferred_rows": [2, 4, 6]},
    {"name": "FOLD_P",   "members": ["M6", "M7"],              "matched": true,  "ring": true, "well": "NW", "preferred_rows": [2, 4, 6]},
    {"name": "BIAS_N",   "members": ["M16", "M5", "M10"],      "matched": true,  "ring": true, "well": "PW", "preferred_rows": [2, 4, 6]},
    {"name": "MIRROR_P", "members": ["M11", "M12", "M13"],     "matched": true,  "ring": true, "well": "NW", "preferred_rows": [2, 4, 6]},
    {"name": "OUT",      "members": ["M14"],                   "matched": false, "ring": true, "well": "DNW", "preferred_rows": [2, 4, 6]}
  ],
  "passives": [
    {
      "name": "C1",
      "type": "MOM",
      "value": 5,
      "unit": "pF",
      "footprint_um": [5, 10],
      "m": 1,
      "ring": true,
      "ring_gap_um": 0.8,
      "ring_width_um": 1.0,
      "dnw": "DNW1"
    },
    {
      "name": "R1",
      "type": "resistor",
      "value": 3.33,
      "unit": "kOhm",
      "footprint_um": [4.5, 6.5],
      "m": 4,
      "ring": true,
      "ring_gap_um": 0.8,
      "ring_width_um": 1.0,
      "dnw": "DNW1",
      "array": {"rows": 2, "cols": 2, "gap_x_um": 0.5, "gap_y_um": 0.5}
    }
  ],
  "rules": {
    "source": "SKY130 open PDK / sky130.lydrc",
    "source_version": "downloaded 2026-10-26",
    "gate_pitch_extra_um": 0.36,
    "ring_gap_um": 0.8,
    "ring_width_um": 1.0,
    "group_gap_um": 2.0,
    "dnw_gap_um": 8.0,
    "nwell_spacing_um": 1.27,
    "nwell_pdiff_enclosure_um": 0.18,
    "ndiff_nwell_spacing_um": 0.34,
    "dnwell_spacing_um": 6.3
  },
  "constraints": {
    "objective": "min_area",
    "aspect_max": null,
    "input_center_tolerance_um": null,
    "output_outer": true,
    "passives_inside_dnw": true,
    "local_empty": {"max_w_um": 5, "max_h_um": 5, "max_area_fraction": 0.02},
    "dummy_policy": "same_geometry",
    "fake_fill": false,
    "area_denominator": "dnw_bbox",
    "effective_area": "ring_inner_plus_ring_aa_plus_passives"
  },
  "priorities": {
    "hard": [
      "passives_inside_dnw",
      "ring_aa_counted",
      "dummy_same_geometry",
      "no_fake_fill",
      "output_outer",
      "dnw_gap",
      "local_empty",
      "no_drc_lvs_claim"
    ],
    "objective": ["min_module_bbox_area"],
    "soft": ["input_center", "aspect", "parasitic", "power_return"],
    "calibration": "pending_multi_structure"
  },
  "unknowns": [
    "input_center_tolerance_um",
    "aspect_max",
    "whether shared S/D is allowed for matched pairs",
    "exact R/C ring spacing beyond the current 0.8/1.0 assumption"
  ],
  "assumptions": [
    "Class-A reference; M13 is a PMOS current-source load, M14 is the only signal-driven output.",
    "R/C are inside DNW1; M14 is in DNW2.",
    "White-line intent only; no DRC/LVS/PEX signoff.",
    "Area denominator is the rectangular bbox around DNW1+DNW2 outer boundaries."
  ]
}
